{
  "envelope_version": "1.0",
  "instance_pseudonym": "pseudo-0a1b2c3d4e5f60718293a4b5c6d7e8f9",
  "sent_at": "2026-09-15T03:00:00Z",
  "payload_kind": "health",
  "payload": {
    "health_status": "healthy",
    "last_successful_replay_timestamp": "2026-09-15T02:00:00Z",
    "last_audit_chain_verification_timestamp": "2026-09-15T02:30:00Z",
    "last_update_applied_version": "v3.2.4.5",
    "failed_update_attempts_count": 0
  },
  "customer_audit_id": "550e8400-e29b-41d4-a716-446655440000"
}
